{
  "$schema": "https://json-schema.org/draft/2020-12/schema",
  "title": "config",
  "description": "Teacher's local config. Written by C (the /setup wizard), read by B. ~/.chalkback/config.json. Contains the Hub token; never committed to the repo. §6.2",
  "type": "object",
  "additionalProperties": false,
  "required": ["hub_url", "token", "teacher_id", "workspace_id", "syllabus_id", "timetable", "auto_share", "consent_at"],
  "properties": {
    "hub_url": {"type": "string", "minLength": 1},
    "token": {"type": "string", "minLength": 1},
    "teacher_id": {"type": "string", "minLength": 1},
    "workspace_id": {"type": "string", "minLength": 1},
    "syllabus_id": {"type": "string", "minLength": 1},
    "timetable": {
      "type": "array",
      "items": {
        "type": "object",
        "additionalProperties": false,
        "required": ["day", "start", "end", "class_id"],
        "properties": {
          "day": {"enum": ["MON", "TUE", "WED", "THU", "FRI", "SAT", "SUN"]},
          "start": {"type": "string", "pattern": "^([01]\\d|2[0-3]):[0-5]\\d$"},
          "end": {"type": "string", "pattern": "^([01]\\d|2[0-3]):[0-5]\\d$"},
          "class_id": {"type": "string", "minLength": 1}
        }
      }
    },
    "auto_share": {"type": "boolean"},
    "consent_at": {"type": "string", "pattern": "^\\d{4}-\\d{2}-\\d{2}T\\d{2}:\\d{2}:\\d{2}(\\.\\d+)?[+-]\\d{2}:\\d{2}$"}
  }
}
